{
  "$schema": "https://json-schema.org/draft/2020-12/schema",
  "$id": "https://pukujan.github.io/fossil-core/schemas/benchmark/case-set-v1.schema.json",
  "title": "FOSSIL Benchmark Case Set v1",
  "type": "object",
  "additionalProperties": false,
  "required": [
    "schema_version",
    "case_set_id",
    "title",
    "description",
    "created_at",
    "corpus",
    "cases"
  ],
  "properties": {
    "schema_version": {"const": "fossil.benchmark-case-set.v1"},
    "case_set_id": {
      "type": "string",
      "pattern": "^caseset_[A-Za-z0-9_-]{12,}$"
    },
    "title": {"type": "string", "minLength": 1},
    "description": {"type": "string", "minLength": 1},
    "created_at": {"type": "string", "format": "date-time"},
    "corpus": {
      "type": "array",
      "minItems": 1,
      "uniqueItems": true,
      "items": {
        "type": "object",
        "additionalProperties": false,
        "required": ["pack_id", "repository", "commit_sha"],
        "properties": {
          "pack_id": {
            "type": "string",
            "pattern": "^pack_[A-Za-z0-9_-]{16,}$"
          },
          "repository": {"type": "string", "minLength": 3},
          "commit_sha": {
            "type": "string",
            "pattern": "^[a-f0-9]{40}$"
          }
        }
      }
    },
    "cases": {
      "type": "array",
      "minItems": 1,
      "items": {
        "oneOf": [
          {"$ref": "#/$defs/retrieval_case"},
          {"$ref": "#/$defs/model_case"}
        ]
      }
    }
  },
  "$defs": {
    "hash": {
      "type": "object",
      "additionalProperties": false,
      "required": ["algorithm", "digest"],
      "properties": {
        "algorithm": {"const": "sha256"},
        "digest": {"type": "string", "pattern": "^[a-f0-9]{64}$"}
      }
    },
    "citation": {
      "type": "object",
      "additionalProperties": false,
      "required": [
        "schema_version",
        "citation_id",
        "snapshot_id",
        "artifact_id",
        "byte_start",
        "byte_end",
        "passage_hash"
      ],
      "properties": {
        "schema_version": {"const": "fossil.citation.v1"},
        "citation_id": {
          "type": "string",
          "pattern": "^cite_[A-Za-z0-9_-]{12,}$"
        },
        "snapshot_id": {
          "type": "string",
          "pattern": "^snap_[A-Za-z0-9_-]{12,}$"
        },
        "artifact_id": {
          "type": "string",
          "pattern": "^art_[A-Za-z0-9_-]{16,}$"
        },
        "byte_start": {"type": ["integer", "null"], "minimum": 0},
        "byte_end": {"type": ["integer", "null"], "minimum": 1},
        "passage_hash": {
          "oneOf": [
            {"type": "null"},
            {"$ref": "#/$defs/hash"}
          ]
        }
      },
      "allOf": [
        {
          "if": {"properties": {"byte_start": {"type": "integer"}}},
          "then": {
            "properties": {
              "byte_end": {"type": "integer"},
              "passage_hash": {"$ref": "#/$defs/hash"}
            }
          }
        },
        {
          "if": {"properties": {"byte_end": {"type": "integer"}}},
          "then": {"properties": {"byte_start": {"type": "integer"}}}
        }
      ]
    },
    "gold": {
      "type": "object",
      "additionalProperties": false,
      "properties": {
        "answerable": {"type": "boolean"},
        "expected_answer": {"type": ["string", "null"]},
        "citations": {
          "type": "array",
          "uniqueItems": true,
          "items": {"$ref": "#/$defs/citation"}
        },
        "source_snapshot_ids": {
          "type": "array",
          "uniqueItems": true,
          "items": {
            "type": "string",
            "pattern": "^snap_[A-Za-z0-9_-]{12,}$"
          }
        },
        "notes": {"type": ["string", "null"]}
      }
    },
    "retrieval_case": {
      "type": "object",
      "additionalProperties": false,
      "required": [
        "kind",
        "case_id",
        "category",
        "query",
        "pack_ids",
        "relevant_ids",
        "gold"
      ],
      "properties": {
        "kind": {"const": "retrieval"},
        "case_id": {"type": "string", "minLength": 1},
        "category": {"type": "string", "minLength": 1},
        "query": {"type": "string", "minLength": 1},
        "pack_ids": {
          "type": "array",
          "minItems": 1,
          "uniqueItems": true,
          "items": {
            "type": "string",
            "pattern": "^pack_[A-Za-z0-9_-]{16,}$"
          }
        },
        "relevant_ids": {
          "type": "array",
          "minItems": 1,
          "uniqueItems": true,
          "items": {"type": "string", "minLength": 1}
        },
        "gold": {"$ref": "#/$defs/gold"},
        "tags": {
          "type": "array",
          "uniqueItems": true,
          "items": {"type": "string", "minLength": 1}
        }
      }
    },
    "model_case": {
      "type": "object",
      "additionalProperties": false,
      "required": [
        "kind",
        "case_id",
        "category",
        "task",
        "expected_output",
        "gold"
      ],
      "properties": {
        "kind": {"const": "model"},
        "case_id": {"type": "string", "minLength": 1},
        "category": {"type": "string", "minLength": 1},
        "task": {"type": "object"},
        "expected_output": {
          "type": "object",
          "minProperties": 1
        },
        "gold": {"$ref": "#/$defs/gold"},
        "tags": {
          "type": "array",
          "uniqueItems": true,
          "items": {"type": "string", "minLength": 1}
        }
      }
    }
  }
}
