{"schema_version":"fossil.benchmark-case-set.v1","case_set_id":"caseset_gate2_real_corpus_history_v2","title":"Gate 2 real corpus history-rich benchmark","description":"History-rich Gate 2A retrieval benchmark pinned to validated fossil-common and fossil-ai-systems commits. Twenty-one inspectable gold/adversarial cases cover exact factual lookup, source/citation recovery, decision lineage, current-vs-historical conclusions, contradiction/disagreement, derived staleness after supersession, cross-pack isolation, obscure/deep evidence, conversation-lineage provenance boundaries, and insufficient-evidence negatives. Reconstructed chat recovery is explicitly not treated as verbatim evidence.","created_at":"2026-08-10T05:40:00Z","corpus":[{"pack_id":"pack_269099f7b2ba43b7a99b9427d64092de","repository":"Pukujan/fossil-common","commit_sha":"d583005dce06dbb499c3c0de5c22b899655eb8d2"},{"pack_id":"pack_f024177f89a5442db84171c3dd7f58e5","repository":"Pukujan/fossil-ai-systems","commit_sha":"cf7cf4087bde543cb247a978de2a7252b1b8e4de"}],"cases":[{"kind":"retrieval","case_id":"source_quality_claim_specific","category":"source-citation-recovery","query":"Is source quality one universal tier, or evaluated for the claim at hand?","pack_ids":["pack_269099f7b2ba43b7a99b9427d64092de"],"relevant_ids":["clm_32f20bd13ce2ffc9d2ac1606"],"gold":{"answerable":true,"expected_answer":"Source usefulness is evaluated for the claim at hand; no universal truth tier is canonical.","citations":[{"schema_version":"fossil.citation.v1","citation_id":"cite_01c22dab70d6c3be3c68a19d","snapshot_id":"snap_db9b79769c035331176f9078","artifact_id":"art_de19a43cd2c65641b0f16244fd8b4ce3","byte_start":41,"byte_end":152,"passage_hash":{"algorithm":"sha256","digest":"abe5cdc71ee89bd86b15bf514582deb9a4d61913129981a9b93eed7cb3118a3b"}}],"source_snapshot_ids":["snap_db9b79769c035331176f9078"]}},{"kind":"retrieval","case_id":"model_agreement_not_evidence","category":"insufficient-evidence","query":"Several models agree on a claim. Is that agreement itself external evidence?","pack_ids":["pack_269099f7b2ba43b7a99b9427d64092de"],"relevant_ids":["clm_7fee179225b3ef0c4d413917"],"gold":{"answerable":true,"expected_answer":"No. Model agreement is not external evidence.","citations":[{"schema_version":"fossil.citation.v1","citation_id":"cite_728e3d95a48f62c4752a6813","snapshot_id":"snap_db9b79769c035331176f9078","artifact_id":"art_de19a43cd2c65641b0f16244fd8b4ce3","byte_start":1445,"byte_end":1524,"passage_hash":{"algorithm":"sha256","digest":"968a1fb27d0830c4eda4e73f1d7ed02ee4bcfb59c30bd7fcafce72ee5afe213d"}}],"source_snapshot_ids":["snap_db9b79769c035331176f9078"]}},{"kind":"retrieval","case_id":"insufficient_evidence_keeps_uncertainty","category":"insufficient-evidence","query":"What state should FOSSIL preserve when evidence is insufficient?","pack_ids":["pack_269099f7b2ba43b7a99b9427d64092de"],"relevant_ids":["clm_041fdd3cc6542b6dca47b183"],"gold":{"answerable":true,"expected_answer":"Preserve an open or disputed state rather than manufacturing certainty.","citations":[{"schema_version":"fossil.citation.v1","citation_id":"cite_0d7926a954d1eb4be1826923","snapshot_id":"snap_db9b79769c035331176f9078","artifact_id":"art_de19a43cd2c65641b0f16244fd8b4ce3","byte_start":1851,"byte_end":1945,"passage_hash":{"algorithm":"sha256","digest":"3fee2e2f02476d3ee403cfa5355a75ef61ae786f06681970a580a177dcdf4521"}}],"source_snapshot_ids":["snap_db9b79769c035331176f9078"]}},{"kind":"retrieval","case_id":"gate1_controls_not_winners","category":"exact-factual-lookup","query":"Did Gate 1 choose BM25, hash embeddings, or token overlap as the production winner?","pack_ids":["pack_f024177f89a5442db84171c3dd7f58e5"],"relevant_ids":["clm_6542963629260bde4e67d660"],"gold":{"answerable":true,"expected_answer":"No. They are controls, not selected production winners.","citations":[{"schema_version":"fossil.citation.v1","citation_id":"cite_6f0654039897a821db51556d","snapshot_id":"snap_20a0b8a7cb36af4ad7cc524d","artifact_id":"art_1f5bfce41253c0082dc616d2ab2c0bcd","byte_start":5349,"byte_end":5540,"passage_hash":{"algorithm":"sha256","digest":"b0af36757674118182f473ab83c7171eaa786a237b8771b9745d75fb19836e0e"}}],"source_snapshot_ids":["snap_20a0b8a7cb36af4ad7cc524d"]}},{"kind":"retrieval","case_id":"fresh_build_scoped_ledger","category":"obscure-deep-evidence","query":"What ledger rule prevents an empty rebuild after destructive graph replacement?","pack_ids":["pack_f024177f89a5442db84171c3dd7f58e5"],"relevant_ids":["clm_62b7f9c6184b14371338ca36"],"gold":{"answerable":true,"expected_answer":"A fresh physical projection build receives a fresh build-scoped applied ledger.","citations":[{"schema_version":"fossil.citation.v1","citation_id":"cite_a7b7a1e100878d4b4b74c200","snapshot_id":"snap_62f9309f69a2ca17a4cb58d7","artifact_id":"art_18bda6bac1e88958215e7c57e32f6918","byte_start":2068,"byte_end":2345,"passage_hash":{"algorithm":"sha256","digest":"303892d2e28601a0be8d6057b74e8a0d6299bd86f1467929635ff3e5adfd92e8"}}],"source_snapshot_ids":["snap_62f9309f69a2ca17a4cb58d7"]}},{"kind":"retrieval","case_id":"candidate_authority_cross_pack_dependency","category":"cross-pack-isolation","query":"What cross-pack relation connects candidate-model authority to the common model-evidence rule?","pack_ids":["pack_269099f7b2ba43b7a99b9427d64092de","pack_f024177f89a5442db84171c3dd7f58e5"],"relevant_ids":["rel_04b8861fde6b22abcae58ef4"],"gold":{"answerable":true,"expected_answer":"The AI candidate-authority claim DEPENDS_ON the common claim that model agreement is not external evidence.","citations":[{"schema_version":"fossil.citation.v1","citation_id":"cite_9627e9c6c9e4aaa3e87e7253","snapshot_id":"snap_20a0b8a7cb36af4ad7cc524d","artifact_id":"art_1f5bfce41253c0082dc616d2ab2c0bcd","byte_start":3085,"byte_end":3162,"passage_hash":{"algorithm":"sha256","digest":"33d5f7592880fec739127c1d1f8be6bdf418a401b5356dd7572605b58e83b7cd"}},{"schema_version":"fossil.citation.v1","citation_id":"cite_728e3d95a48f62c4752a6813","snapshot_id":"snap_db9b79769c035331176f9078","artifact_id":"art_de19a43cd2c65641b0f16244fd8b4ce3","byte_start":1445,"byte_end":1524,"passage_hash":{"algorithm":"sha256","digest":"968a1fb27d0830c4eda4e73f1d7ed02ee4bcfb59c30bd7fcafce72ee5afe213d"}}],"source_snapshot_ids":["snap_20a0b8a7cb36af4ad7cc524d","snap_db9b79769c035331176f9078"]}},{"kind":"retrieval","case_id":"current_architecture_after_reconsideration","category":"current-vs-historical","query":"What is the current accepted durable architecture after storage alternatives were reconsidered?","pack_ids":["pack_f024177f89a5442db84171c3dd7f58e5"],"relevant_ids":["clm_7f5c691c564c30e1b61f8dc0"],"gold":{"answerable":true,"expected_answer":"Immutable evidence plus append-only knowledge events are durable truth; Graphiti/Neo4j and retrieval are rebuildable projections.","citations":[{"schema_version":"fossil.citation.v1","citation_id":"cite_94733f286d230834c9cf63ac","snapshot_id":"snap_397c01212e0679f148ad765c","artifact_id":"art_dee91189c7b320acffe3db41bad37fdd","byte_start":1257,"byte_end":1483,"passage_hash":{"algorithm":"sha256","digest":"1e5fcf3d341bed3eb9b168e15ef163adecb34cd5792a56a3490cb17b1329f6ec"}}],"source_snapshot_ids":["snap_397c01212e0679f148ad765c"]}},{"kind":"retrieval","case_id":"former_sqlite_canonical_history","category":"current-vs-historical","query":"What earlier SQLite-canonical conclusion was later demoted?","pack_ids":["pack_f024177f89a5442db84171c3dd7f58e5"],"relevant_ids":["clm_643b698b7e9e6aee6a16c48c"],"gold":{"answerable":true,"expected_answer":"The earlier SQLite-canonical conclusion was later superseded.","citations":[{"schema_version":"fossil.citation.v1","citation_id":"cite_b4e13e4e1a809f76527311ba","snapshot_id":"snap_397c01212e0679f148ad765c","artifact_id":"art_dee91189c7b320acffe3db41bad37fdd","byte_start":2102,"byte_end":2238,"passage_hash":{"algorithm":"sha256","digest":"8014322576d0d85898dccb3323dfec087e7459c5c0bc15bd90d437b7b2fcf2b0"}}],"source_snapshot_ids":["snap_397c01212e0679f148ad765c"]}},{"kind":"retrieval","case_id":"sqlite_supersession_lineage","category":"decision-lineage","query":"Which durable relation connects the replacement architecture to the former SQLite-canonical claim?","pack_ids":["pack_f024177f89a5442db84171c3dd7f58e5"],"relevant_ids":["rel_e0102ade0b5fad5cc2668ccd"],"gold":{"answerable":true,"expected_answer":"The current architecture SUPERSEDES the former SQLite-canonical claim.","citations":[{"schema_version":"fossil.citation.v1","citation_id":"cite_94733f286d230834c9cf63ac","snapshot_id":"snap_397c01212e0679f148ad765c","artifact_id":"art_dee91189c7b320acffe3db41bad37fdd","byte_start":1257,"byte_end":1483,"passage_hash":{"algorithm":"sha256","digest":"1e5fcf3d341bed3eb9b168e15ef163adecb34cd5792a56a3490cb17b1329f6ec"}},{"schema_version":"fossil.citation.v1","citation_id":"cite_b4e13e4e1a809f76527311ba","snapshot_id":"snap_397c01212e0679f148ad765c","artifact_id":"art_dee91189c7b320acffe3db41bad37fdd","byte_start":2102,"byte_end":2238,"passage_hash":{"algorithm":"sha256","digest":"8014322576d0d85898dccb3323dfec087e7459c5c0bc15bd90d437b7b2fcf2b0"}}],"source_snapshot_ids":["snap_397c01212e0679f148ad765c"]}},{"kind":"retrieval","case_id":"sqlite_dependent_staleness","category":"stale-superseded","query":"What happens to the dependent SQLite-prototype claim after its canonical SQLite premise is superseded?","pack_ids":["pack_f024177f89a5442db84171c3dd7f58e5"],"relevant_ids":["clm_a047d79b8604fadbd44efdf4"],"gold":{"answerable":true,"expected_answer":"It becomes stale_pending_review through lifecycle replay.","citations":[{"schema_version":"fossil.citation.v1","citation_id":"cite_b4e13e4e1a809f76527311ba","snapshot_id":"snap_397c01212e0679f148ad765c","artifact_id":"art_dee91189c7b320acffe3db41bad37fdd","byte_start":2102,"byte_end":2238,"passage_hash":{"algorithm":"sha256","digest":"8014322576d0d85898dccb3323dfec087e7459c5c0bc15bd90d437b7b2fcf2b0"}}],"source_snapshot_ids":["snap_397c01212e0679f148ad765c"]}},{"kin